<?xml version="1.0" encoding="UTF-8" ?>
<NETWORK xmlns="http://www.opentrafficsim.org/ots" xmlns:ots="http://www.opentrafficsim.org/ots" xmlns:xsi="http://www.w3.org/2001/XMLSchema-instance"
  xsi:schemaLocation="http://www.opentrafficsim.org/ots http://www.opentrafficsim.org/docs/ots-network.xsd" xmlns:xi="http://www.w3.org/2001/XInclude">

  <xi:include href="roadtypes.xml" parse="xml" />

  <DEFINITIONS>

    <GTU NAME="BICYCLE" GTUTYPE="BICYCLE" FOLLOWING="IDM" LENGTH="CONST(2) m" WIDTH="CONST(0.5) m" LANECHANGE="ALTRUISTIC"
      MAXSPEED="CONST(25) km/h" />
    <GTU NAME="CAR" GTUTYPE="CAR" FOLLOWING="IDM+" LENGTH="CONST(5) m" WIDTH="UNIF(1.7, 2) m" LANECHANGE="EGOISTIC"
      MAXSPEED="TRIA(50,80,120) km/h" />
    <GTU NAME="TRUCK" GTUTYPE="TRUCK" FOLLOWING="IDM+" LENGTH="UNIF(16,24) m" WIDTH="UNIF(2.2, 2.7) m" LANECHANGE="ALTRUISTIC"
      MAXSPEED="CONST(100) km/h" />

    <GTUMIX NAME="C60T40">
      <GTU NAME="CAR" WEIGHT="60"></GTU>
      <GTU NAME="TRUCK" WEIGHT="40"></GTU>
    </GTUMIX>

    <GTUMIX NAME="C80T20">
      <GTU NAME="CAR" WEIGHT="80" />
      <GTU NAME="TRUCK" WEIGHT="20" />
    </GTUMIX>

    <COMPATIBILITY LANETYPE="HIGHWAY" GTULIST="CAR TRUCK" />
    <COMPATIBILITY LANETYPE="NOTRUCK" GTULIST="CAR" />
    <COMPATIBILITY LANETYPE="BICYCLEPATH" GTULIST="BICYCLE" />

  </DEFINITIONS>


  <NODE NAME="N1" COORDINATE="(0.0, 0.0)" ANGLE="90 deg" />
  <NODE NAME="N1a" />
  <NODE NAME="N2" />
  <NODE NAME="NE" />
  <NODE NAME="NE2" />

  <ROUTE NAME="CIRCLE" NODELIST="NE N1 N1a N2 N1" />

  <LINK NAME="L1" NODESTART="N1" NODEEND="N1a" ROADTYPE="r3">
    <ARC RADIUS="1000m" ANGLE="45 deg" DIRECTION="L" />
    <BLOCK LANE="A1" POSITION="END-10cm" />
    <BLOCK LANE="A2" POSITION="END-10cm" />
  </LINK>

  <LINK NAME="L1a" NODESTART="N1a" NODEEND="N2" ROADTYPE="r2">
    <ARC RADIUS="1000m" ANGLE="135 deg" DIRECTION="L" />
  </LINK>

  <LINK NAME="L2" NODESTART="N2" NODEEND="N1" ROADTYPE="r2">
    <ARC RADIUS="1000m" ANGLE="180 deg" DIRECTION="L" />
    <SENSOR LANE="A1" POSITION="END-13m" CLASS="nl.grontmij.GuusSensor" TRIGGER="FRONT" />
  </LINK>

  <LINK NAME="ENTRY" NODESTART="NE" NODEEND="N1" ROADTYPE="r1">
    <STRAIGHT LENGTH="200m" />
  </LINK>

  <LINK NAME="ENTRY2" NODESTART="NE2" NODEEND="NE" ROADTYPE="r1">
    <STRAIGHT LENGTH="200m" />
    <LANEOVERRIDE LANE="A1" SPEED="50 km/h" />
    <!-- GENERATOR LANE="A1" IAT="EXPO(30) s" INITIALSPEED="CONST(0.0) km/h" MAXGTU="50" GTUMIX="C80T20" ROUTE="CIRCLE" GTUCOLORER="SWITCHABLE" 
      / -->
    <!-- GENERATOR LANE="A1" POSITION="10m" IAT="EXPO(30) s" INITIALSPEED="CONST(0.0) km/h" MAXGTU="250" GTU="CAR" ROUTE="CIRCLE" 
      GTUCOLORER="SWITCHABLE" / -->
    <GENERATOR LANE="A1" POSITION="10m" IAT="CONST(10) s" INITIALSPEED="CONST(0.0) km/h" MAXGTU="250" GTU="CAR"
      ROUTE="CIRCLE" GTUCOLORER="SWITCHABLE" />
  </LINK>

</NETWORK>
